{
  "$schema": "https://json-schema.org/draft/2020-12/schema",
  "$id": "https://github.com/sinangym/GoymenERP/docs/knowledge/schema/source-registry-v1.schema.json",
  "title": "Göymen ERP knowledge source registry v1",
  "type": "object",
  "additionalProperties": false,
  "required": [
    "schema_version",
    "run_id",
    "canonical_repository",
    "default_branch",
    "state",
    "source_inventory_attestation",
    "required_providers",
    "expected_sources",
    "sources"
  ],
  "properties": {
    "schema_version": { "const": "1.0" },
    "run_id": { "const": "GOYMENERP-KNOWLEDGE-V4-01" },
    "canonical_repository": { "const": "https://github.com/sinangym/GoymenERP.git" },
    "default_branch": { "const": "main" },
    "state": { "enum": ["collecting", "ready"] },
    "source_inventory_attestation": {
      "$ref": "#/$defs/source_inventory_attestation"
    },
    "required_providers": {
      "type": "array",
      "prefixItems": [
        { "const": "codex" },
        { "const": "claude" },
        { "const": "chatgpt" }
      ],
      "items": false,
      "minItems": 3,
      "maxItems": 3
    },
    "expected_sources": {
      "type": "array",
      "items": { "$ref": "#/$defs/expected_source" }
    },
    "sources": {
      "type": "array",
      "items": { "$ref": "#/$defs/source" }
    }
  },
  "allOf": [
    {
      "if": {
        "properties": { "state": { "const": "ready" } },
        "required": ["state"]
      },
      "then": {
        "properties": {
          "source_inventory_attestation": {
            "properties": {
              "status": { "const": "user_confirmed_complete" }
            }
          },
          "expected_sources": {
            "minItems": 3,
            "items": {
              "allOf": [
                { "$ref": "#/$defs/expected_source" },
                {
                  "if": {
                    "properties": { "required": { "const": true } },
                    "required": ["required"]
                  },
                  "then": {
                    "properties": { "status": { "const": "imported" } }
                  }
                }
              ]
            },
            "allOf": [
              {
                "contains": {
                  "properties": {
                    "provider": { "const": "codex" },
                    "required": { "const": true }
                  },
                  "required": ["provider", "required"]
                },
                "minContains": 1
              },
              {
                "contains": {
                  "properties": {
                    "provider": { "const": "claude" },
                    "required": { "const": true }
                  },
                  "required": ["provider", "required"]
                },
                "minContains": 1
              },
              {
                "contains": {
                  "properties": {
                    "provider": { "const": "chatgpt" },
                    "required": { "const": true }
                  },
                  "required": ["provider", "required"]
                },
                "minContains": 1
              }
            ]
          },
          "sources": {
            "minItems": 3,
            "items": {
              "allOf": [
                { "$ref": "#/$defs/source" },
                {
                  "properties": {
                    "status": { "enum": ["integrated", "superseded"] }
                  }
                }
              ]
            },
            "allOf": [
              {
                "contains": {
                  "properties": {
                    "provider": { "const": "codex" },
                    "status": { "const": "integrated" }
                  },
                  "required": ["provider", "status"]
                },
                "minContains": 1
              },
              {
                "contains": {
                  "properties": {
                    "provider": { "const": "claude" },
                    "status": { "const": "integrated" }
                  },
                  "required": ["provider", "status"]
                },
                "minContains": 1
              },
              {
                "contains": {
                  "properties": {
                    "provider": { "const": "chatgpt" },
                    "status": { "const": "integrated" }
                  },
                  "required": ["provider", "status"]
                },
                "minContains": 1
              }
            ]
          }
        }
      }
    }
  ],
  "$defs": {
    "source_inventory_attestation": {
      "type": "object",
      "additionalProperties": false,
      "required": [
        "status",
        "attested_by",
        "attested_at",
        "evidence_locator",
        "scope_note"
      ],
      "properties": {
        "status": { "enum": ["pending", "user_confirmed_complete"] },
        "attested_by": { "type": ["string", "null"], "minLength": 1 },
        "attested_at": {
          "oneOf": [
            { "type": "null" },
            {
              "type": "string",
              "pattern": "^\\d{4}-\\d{2}-\\d{2}T\\d{2}:\\d{2}(?::\\d{2}(?:\\.\\d{1,6})?)?(?:Z|[+-]\\d{2}:\\d{2})$"
            }
          ]
        },
        "evidence_locator": { "type": ["string", "null"], "minLength": 1 },
        "scope_note": { "type": ["string", "null"], "minLength": 1 }
      },
      "allOf": [
        {
          "if": {
            "properties": { "status": { "const": "pending" } },
            "required": ["status"]
          },
          "then": {
            "properties": {
              "attested_by": { "type": "null" },
              "attested_at": { "type": "null" },
              "evidence_locator": { "type": "null" },
              "scope_note": { "type": "null" }
            }
          }
        },
        {
          "if": {
            "properties": { "status": { "const": "user_confirmed_complete" } },
            "required": ["status"]
          },
          "then": {
            "properties": {
              "attested_by": { "type": "string", "minLength": 1 },
              "attested_at": { "type": "string" },
              "evidence_locator": { "type": "string", "minLength": 1 },
              "scope_note": { "type": "string", "minLength": 1 }
            }
          }
        }
      ]
    },
    "expected_source": {
      "type": "object",
      "additionalProperties": false,
      "required": [
        "provider",
        "conversation_id",
        "required",
        "status",
        "source_id",
        "reason"
      ],
      "properties": {
        "provider": { "enum": ["codex", "claude", "chatgpt"] },
        "conversation_id": { "type": "string", "minLength": 1, "maxLength": 256 },
        "required": { "type": "boolean" },
        "status": { "enum": ["pending", "imported", "unavailable"] },
        "source_id": {
          "oneOf": [
            { "type": "null" },
            { "type": "string", "pattern": "^[a-z0-9][a-z0-9-]{2,95}$" }
          ]
        },
        "reason": {
          "oneOf": [
            { "type": "null" },
            { "type": "string", "minLength": 1 }
          ]
        }
      },
      "allOf": [
        {
          "if": {
            "properties": { "status": { "const": "pending" } },
            "required": ["status"]
          },
          "then": {
            "properties": {
              "source_id": { "type": "null" },
              "reason": { "type": "null" }
            }
          }
        },
        {
          "if": {
            "properties": { "status": { "const": "imported" } },
            "required": ["status"]
          },
          "then": {
            "properties": {
              "source_id": { "type": "string" },
              "reason": { "type": "null" }
            }
          }
        },
        {
          "if": {
            "properties": { "status": { "const": "unavailable" } },
            "required": ["status"]
          },
          "then": {
            "properties": {
              "source_id": { "type": "null" },
              "reason": { "type": "string", "minLength": 1 }
            }
          }
        }
      ]
    },
    "source": {
      "type": "object",
      "additionalProperties": false,
      "required": [
        "provider",
        "source_id",
        "conversation_id",
        "manifest_path",
        "content_fingerprint_sha256",
        "status"
      ],
      "properties": {
        "provider": { "enum": ["codex", "claude", "chatgpt"] },
        "source_id": { "type": "string", "pattern": "^[a-z0-9][a-z0-9-]{2,95}$" },
        "conversation_id": { "type": "string", "minLength": 1, "maxLength": 256 },
        "manifest_path": {
          "type": "string",
          "pattern": "^docs/knowledge/inbox/GOYMENERP-KNOWLEDGE-V4-01/(codex|claude|chatgpt)/[a-z0-9][a-z0-9-]{2,95}/SOURCE_MANIFEST\\.json$"
        },
        "content_fingerprint_sha256": {
          "type": "string",
          "pattern": "^[0-9a-f]{64}$"
        },
        "status": { "enum": ["validated", "integrated", "superseded"] }
      }
    }
  }
}
